{"protocol_version":"1.0","run_id":"RUN-1","attempt_id":"ATT-1","project_id":"PRJ-1","stage":"CODING","objective":"Implement the approved slice","baseline_refs":[{"id":"BL-1","version":"1.0.0","content_hash":"sha256:0000000000000000000000000000000000000000000000000000000000000000"}],"agent_definition_ref":{"id":"AGT-1","version":"1.0.0","content_hash":"sha256:1111111111111111111111111111111111111111111111111111111111111111"},"prompt_template_ref":{"id":"PRM-1","version":"1.0.0","content_hash":"sha256:2222222222222222222222222222222222222222222222222222222222222222"},"rule_set_ref":{"id":"RUL-1","version":"1.0.0","content_hash":"sha256:3333333333333333333333333333333333333333333333333333333333333333"},"budget":{"max_duration_ms":60000,"max_host_calls":2,"max_output_tokens":4000,"max_cost_usd":1.5},"idempotency_key":"run-1-attempt-1","requested_at":"2026-08-05T10:00:00Z"}
